{"backfillPolicyId":"s3-lag60-settle60-kst6h-chronological-v1","classification":"PRIVACY_SAFE_AGGREGATE_BACKFILL_SEED_DRY_RUN_ONLY","featureContractVersion":"observed-max-capacity-v1","generatedAtGuardSeconds":60,"lastBackfilledGenerationUtc":"2026-09-02T09:00:00.000000Z","privacy":{"containsPlateValues":false,"containsRawRows":false,"containsVehicleHmacs":false,"containsVehicleIdentifiers":false},"rdsObservationDeltaContract":"rds-observation-delta-contract.json","requiresRdsObservationDeltaBeforeFormalCutover":true,"routeReference":{"digest":"50568d9a10b567ea0b650cd79ceed39a86947648e303e0d8fd1093840bb54c5e","version":"gbis-2026-08-19"},"rows":[{"arrivalDateKst":"2026-08-14","arrivalHourStartUtc":"2026-08-14T07:00:00Z","capacityTotal":98.0,"fillRateTotal":1.9591836734693877,"modelRoute":"1650","netBoardingTotal":6.0,"sampleCount":2,"stopOrder":26},{"arrivalDateKst":"2026-08-15","arrivalHourStartUtc":"2026-08-15T00:00:00Z","capacityTotal":44.0,"fillRateTotal":0.2727272727272727,"modelRoute":"1650","netBoardingTotal":2.0,"sampleCount":1,"stopOrder":7},{"arrivalDateKst":"2026-08-15","arrivalHourStartUtc":"2026-08-15T07:00:00Z","capacityTotal":225.0,"fillRateTotal":4.716141001855288,"modelRoute":"1650","netBoardingTotal":23.0,"sampleCount":5,"stopOrder":61},{"arrivalDateKst":"2026-08-16","arrivalHourStartUtc":"2026-08-15T23:00:00Z","capacityTotal":440.0,"fillRateTotal":0.6136363636363639,"modelRoute":"1650","netBoardingTotal":10.0,"sampleCount":10,"stopOrder":47},{"arrivalDateKst":"2026-08-16","arrivalHourStartUtc":"2026-08-16T07:00:00Z","capacityTotal":44.0,"fillRateTotal":0.15909090909090906,"modelRoute":"1650","netBoardingTotal":1.0,"sampleCount":1,"stopOrder":5},{"arrivalDateKst":"2026-08-17","arrivalHourStartUtc":"2026-08-16T22:00:00Z","capacityTotal":1028.0,"fillRateTotal":2.1512059369202245,"modelRoute":"1650","netBoardingTotal":-24.0,"sampleCount":22,"stopOrder":76},{"arrivalDateKst":"2026-08-17","arrivalHourStartUtc":"2026-08-17T06:00:00Z","capacityTotal":88.0,"fillRateTotal":0.25,"modelRoute":"1650","netBoardingTotal":1.0,"sampleCount":2,"stopOrder":49},{"arrivalDateKst":"2026-08-17","arrivalHourStartUtc":"2026-08-17T14:00:00Z","capacityTotal":455.0,"fillRateTotal":2.2592764378478667,"modelRoute":"1650","netBoardingTotal":43.0,"sampleCount":10,"stopOrder":55},{"arrivalDateKst":"2026-08-18","arrivalHourStartUtc":"2026-08-18T02:00:00Z","capacityTotal":186.0,"fillRateTotal":1.134508348794063,"modelRoute":"1650","netBoardingTotal":5.0,"sampleCount":4,"stopOrder":54},{"arrivalDateKst":"2026-08-18","arrivalHourStartUtc":"2026-08-18T09:00:00Z","capacityTotal":2917.0,"fillRateTotal":23.79494949494948,"modelRoute":"1650","netBoardingTotal":460.0,"sampleCount":66,"stopOrder":55},{"arrivalDateKst":"2026-08-19","arrivalHourStartUtc":"2026-08-18T21:00:00Z","capacityTotal":132.0,"fillRateTotal":2.272727272727273,"modelRoute":"1650","netBoardingTotal":8.0,"sampleCount":3,"stopOrder":56},{"arrivalDateKst":"2026-08-19","arrivalHourStartUtc":"2026-08-19T04:00:00Z","capacityTotal":1936.0,"fillRateTotal":2.818181818181819,"modelRoute":"1650","netBoardingTotal":-21.0,"sampleCount":44,"stopOrder":71},{"arrivalDateKst":"2026-08-19","arrivalHourStartUtc":"2026-08-19T11:00:00Z","capacityTotal":582.0,"fillRateTotal":2.121985157699443,"modelRoute":"1650","netBoardingTotal":0.0,"sampleCount":13,"stopOrder":85},{"arrivalDateKst":"2026-08-20","arrivalHourStartUtc":"2026-08-19T23:00:00Z","capacityTotal":176.0,"fillRateTotal":0.0,"modelRoute":"1650","netBoardingTotal":0.0,"sampleCount":4,"stopOrder":87},{"arrivalDateKst":"2026-08-20","arrivalHourStartUtc":"2026-08-20T07:00:00Z","capacityTotal":1276.0,"fillRateTotal":9.340909090909088,"modelRoute":"1650","netBoardingTotal":-120.0,"sampleCount":29,"stopOrder":32},{"arrivalDateKst":"2026-08-20","arrivalHourStartUtc":"2026-08-20T14:00:00Z","capacityTotal":2367.0,"fillRateTotal":5.964285714285708,"modelRoute":"1650","netBoardingTotal":-54.0,"sampleCount":53,"stopOrder":68},{"arrivalDateKst":"2026-08-21","arrivalHourStartUtc":"2026-08-21T02:00:00Z","capacityTotal":1056.0,"fillRateTotal":6.750000000000002,"modelRoute":"1650","netBoardingTotal":-87.0,"sampleCount":24,"stopOrder":68},{"arrivalDateKst":"2026-08-21","arrivalHourStartUtc":"2026-08-21T09:00:00Z","capacityTotal":924.0,"fillRateTotal":7.31818181818182,"modelRoute":"1650","netBoardingTotal":-73.0,"sampleCount":21,"stopOrder":69},{"arrivalDateKst":"2026-08-22","arrivalHourStartUtc":"2026-08-21T21:00:00Z","capacityTotal":220.0,"fillRateTotal":0.0,"modelRoute":"1650","netBoardingTotal":0.0,"sampleCount":5,"stopOrder":88},{"arrivalDateKst":"2026-08-22","arrivalHourStartUtc":"2026-08-22T05:00:00Z","capacityTotal":264.0,"fillRateTotal":1.0909090909090906,"modelRoute":"1650","netBoardingTotal":6.0,"sampleCount":6,"stopOrder":38},{"arrivalDateKst":"2026-08-22","arrivalHourStartUtc":"2026-08-22T12:00:00Z","capacityTotal":924.0,"fillRateTotal":5.06818181818182,"modelRoute":"1650","netBoardingTotal":-35.0,"sampleCount":21,"stopOrder":65},{"arrivalDateKst":"2026-08-23","arrivalHourStartUtc":"2026-08-23T01:00:00Z","capacityTotal":680.0,"fillRateTotal":1.2439703153988866,"modelRoute":"1650","netBoardingTotal":22.0,"sampleCount":15,"stopOrder":48},{"arrivalDateKst":"2026-08-23","arrivalHourStartUtc":"2026-08-23T08:00:00Z","capacityTotal":220.0,"fillRateTotal":1.5909090909090913,"modelRoute":"1650","netBoardingTotal":-55.0,"sampleCount":5,"stopOrder":69},{"arrivalDateKst":"2026-08-24","arrivalHourStartUtc":"2026-08-23T21:00:00Z","capacityTotal":968.0,"fillRateTotal":1.8636363636363633,"modelRoute":"1650","netBoardingTotal":47.0,"sampleCount":22,"stopOrder":3},{"arrivalDateKst":"2026-08-24","arrivalHourStartUtc":"2026-08-24T04:00:00Z","capacityTotal":1936.0,"fillRateTotal":7.159090909090907,"modelRoute":"1650","netBoardingTotal":-43.0,"sampleCount":44,"stopOrder":32},{"arrivalDateKst":"2026-08-24","arrivalHourStartUtc":"2026-08-24T11:00:00Z","capacityTotal":6500.0,"fillRateTotal":83.04035250463829,"modelRoute":"1650","netBoardingTotal":-1049.0,"sampleCount":145,"stopOrder":33},{"arrivalDateKst":"2026-08-25","arrivalHourStartUtc":"2026-08-24T23:00:00Z","capacityTotal":134.0,"fillRateTotal":1.2121212121212122,"modelRoute":"1650","netBoardingTotal":-3.0,"sampleCount":3,"stopOrder":34},{"arrivalDateKst":"2026-08-25","arrivalHourStartUtc":"2026-08-25T06:00:00Z","capacityTotal":1198.0,"fillRateTotal":0.29499072356215206,"modelRoute":"1650","netBoardingTotal":-18.0,"sampleCount":27,"stopOrder":43},{"arrivalDateKst":"2026-08-25","arrivalHourStartUtc":"2026-08-25T13:00:00Z","capacityTotal":308.0,"fillRateTotal":0.2499999999999999,"modelRoute":"1650","netBoardingTotal":7.0,"sampleCount":7,"stopOrder":48},{"arrivalDateKst":"2026-08-26","arrivalHourStartUtc":"2026-08-26T01:00:00Z","capacityTotal":93.0,"fillRateTotal":0.5695732838589981,"modelRoute":"1650","netBoardingTotal":7.0,"sampleCount":2,"stopOrder":51},{"arrivalDateKst":"2026-08-26","arrivalHourStartUtc":"2026-08-26T08:00:00Z","capacityTotal":1056.0,"fillRateTotal":2.727272727272727,"modelRoute":"1650","netBoardingTotal":-39.0,"sampleCount":24,"stopOrder":72},{"arrivalDateKst":"2026-08-27","arrivalHourStartUtc":"2026-08-26T20:00:00Z","capacityTotal":88.0,"fillRateTotal":0.09090909090909083,"modelRoute":"1650","netBoardingTotal":-3.0,"sampleCount":2,"stopOrder":42},{"arrivalDateKst":"2026-08-27","arrivalHourStartUtc":"2026-08-27T04:00:00Z","capacityTotal":1056.0,"fillRateTotal":0.40909090909090884,"modelRoute":"1650","netBoardingTotal":0.0,"sampleCount":24,"stopOrder":6},{"arrivalDateKst":"2026-08-27","arrivalHourStartUtc":"2026-08-27T11:00:00Z","capacityTotal":3052.0,"fillRateTotal":40.12424242424244,"modelRoute":"1650","netBoardingTotal":266.0,"sampleCount":69,"stopOrder":22},{"arrivalDateKst":"2026-08-28","arrivalHourStartUtc":"2026-08-27T23:00:00Z","capacityTotal":792.0,"fillRateTotal":5.159090909090908,"modelRoute":"1650","netBoardingTotal":35.0,"sampleCount":18,"stopOrder":21},{"arrivalDateKst":"2026-08-28","arrivalHourStartUtc":"2026-08-28T06:00:00Z","capacityTotal":1271.0,"fillRateTotal":18.89100185528757,"modelRoute":"1650","netBoardingTotal":225.0,"sampleCount":28,"stopOrder":24},{"arrivalDateKst":"2026-08-28","arrivalHourStartUtc":"2026-08-28T13:00:00Z","capacityTotal":2719.0,"fillRateTotal":34.98376623376624,"modelRoute":"1650","netBoardingTotal":102.0,"sampleCount":61,"stopOrder":26},{"arrivalDateKst":"2026-08-29","arrivalHourStartUtc":"2026-08-29T01:00:00Z","capacityTotal":137.0,"fillRateTotal":0.7699443413729128,"modelRoute":"1650","netBoardingTotal":10.0,"sampleCount":3,"stopOrder":50},{"arrivalDateKst":"2026-08-29","arrivalHourStartUtc":"2026-08-29T08:00:00Z","capacityTotal":1848.0,"fillRateTotal":21.522727272727273,"modelRoute":"1650","netBoardingTotal":-73.0,"sampleCount":42,"stopOrder":70},{"arrivalDateKst":"2026-08-30","arrivalHourStartUtc":"2026-08-29T21:00:00Z","capacityTotal":690.0,"fillRateTotal":1.6614100185528748,"modelRoute":"1650","netBoardingTotal":0.0,"sampleCount":15,"stopOrder":37},{"arrivalDateKst":"2026-08-30","arrivalHourStartUtc":"2026-08-30T05:00:00Z","capacityTotal":440.0,"fillRateTotal":2.340909090909091,"modelRoute":"1650","netBoardingTotal":21.0,"sampleCount":10,"stopOrder":18},{"arrivalDateKst":"2026-08-30","arrivalHourStartUtc":"2026-08-30T12:00:00Z","capacityTotal":2436.0,"fillRateTotal":14.335343228200356,"modelRoute":"1650","netBoardingTotal":160.0,"sampleCount":54,"stopOrder":58},{"arrivalDateKst":"2026-08-31","arrivalHourStartUtc":"2026-08-31T00:00:00Z","capacityTotal":2445.0,"fillRateTotal":0.8738404452690164,"modelRoute":"1650","netBoardingTotal":-68.0,"sampleCount":55,"stopOrder":78},{"arrivalDateKst":"2026-08-31","arrivalHourStartUtc":"2026-08-31T08:00:00Z","capacityTotal":176.0,"fillRateTotal":0.18181818181818166,"modelRoute":"1650","netBoardingTotal":0.0,"sampleCount":4,"stopOrder":5},{"arrivalDateKst":"2026-09-01","arrivalHourStartUtc":"2026-08-31T19:00:00Z","capacityTotal":132.0,"fillRateTotal":0.75,"modelRoute":"1650","netBoardingTotal":0.0,"sample